{
	"version": "1.0",
	"bpm": 120,
	"totalBeats": 180,
	"gridSize": {
		"rows": 4,
		"cols": 4
	},
	"loopMode": false,
	"instruments": [
		{
			"id": "inst-kick",
			"name": "kick",
			"gridPosition": 0,
			"color": "#e74c3c",
			"offset": 0,
			"maxDuration": 0.5
		},
		{
			"id": "inst-snare",
			"name": "snare",
			"gridPosition": 1,
			"color": "#e67e22",
			"offset": 0,
			"maxDuration": 0.3
		},
		{
			"id": "inst-hihat",
			"name": "hihat",
			"gridPosition": 2,
			"color": "#f1c40f",
			"offset": 0,
			"maxDuration": 0.2
		},
		{
			"id": "inst-hihat-open",
			"name": "hihat-open",
			"gridPosition": 3,
			"color": "#f39c12",
			"offset": 0,
			"maxDuration": 0.4
		},
		{
			"id": "inst-click",
			"name": "click",
			"gridPosition": 4,
			"color": "#2ecc71",
			"offset": 0,
			"maxDuration": 0.2
		},
		{
			"id": "inst-clac",
			"name": "clac",
			"gridPosition": 5,
			"color": "#27ae60",
			"offset": 0,
			"maxDuration": 0.2
		},
		{
			"id": "inst-pop",
			"name": "pop",
			"gridPosition": 6,
			"color": "#1abc9c",
			"offset": 0,
			"maxDuration": 0.3
		},
		{
			"id": "inst-toc",
			"name": "toc",
			"gridPosition": 7,
			"color": "#16a085",
			"offset": 0,
			"maxDuration": 0.15
		},
		{
			"id": "inst-pff",
			"name": "pff",
			"gridPosition": 8,
			"color": "#3498db",
			"offset": 0,
			"maxDuration": 0.5
		},
		{
			"id": "inst-fff",
			"name": "fff",
			"gridPosition": 9,
			"color": "#2980b9",
			"offset": 0,
			"maxDuration": 0.4
		},
		{
			"id": "inst-hhh",
			"name": "hhh",
			"gridPosition": 10,
			"color": "#9b59b6",
			"offset": 0,
			"maxDuration": 0.6
		},
		{
			"id": "inst-sss",
			"name": "sss",
			"gridPosition": 11,
			"color": "#8e44ad",
			"offset": 0,
			"maxDuration": 0.5
		},
		{
			"id": "inst-bwip",
			"name": "bwip",
			"gridPosition": 12,
			"color": "#e91e63",
			"offset": 0,
			"maxDuration": 0.4
		},
		{
			"id": "inst-prr",
			"name": "prr",
			"gridPosition": 13,
			"color": "#c0392b",
			"offset": 0,
			"maxDuration": 0.5
		},
		{
			"id": "inst-gulp",
			"name": "gulp",
			"gridPosition": 14,
			"color": "#7f8c8d",
			"offset": 0,
			"maxDuration": 0.4
		},
		{
			"id": "inst-smack",
			"name": "smack",
			"gridPosition": 15,
			"color": "#ff6b6b",
			"offset": 0,
			"maxDuration": 0.3
		}
	],
	"clips": [
		{ "id": "c-1", "instrumentId": "inst-kick", "startTime": 0, "duration": 1 },
		{ "id": "c-2", "instrumentId": "inst-click", "startTime": 2, "duration": 1 },
		{ "id": "c-3", "instrumentId": "inst-kick", "startTime": 4, "duration": 1 },
		{ "id": "c-4", "instrumentId": "inst-hihat", "startTime": 5, "duration": 1 },
		{ "id": "c-5", "instrumentId": "inst-click", "startTime": 6, "duration": 1 },
		{ "id": "c-6", "instrumentId": "inst-hihat", "startTime": 7, "duration": 1 },
		{ "id": "c-7", "instrumentId": "inst-kick", "startTime": 8, "duration": 1 },
		{ "id": "c-8", "instrumentId": "inst-pff", "startTime": 8, "duration": 1 },
		{ "id": "c-9", "instrumentId": "inst-hihat", "startTime": 9, "duration": 1 },
		{ "id": "c-10", "instrumentId": "inst-click", "startTime": 10, "duration": 1 },
		{ "id": "c-11", "instrumentId": "inst-hihat", "startTime": 11, "duration": 1 },
		{ "id": "c-12", "instrumentId": "inst-kick", "startTime": 12, "duration": 1 },
		{ "id": "c-13", "instrumentId": "inst-hhh", "startTime": 12, "duration": 1 },
		{ "id": "c-14", "instrumentId": "inst-hihat", "startTime": 13, "duration": 1 },
		{ "id": "c-15", "instrumentId": "inst-click", "startTime": 14, "duration": 1 },
		{ "id": "c-16", "instrumentId": "inst-hihat", "startTime": 15, "duration": 1 },

		{ "id": "c-17", "instrumentId": "inst-kick", "startTime": 16, "duration": 1 },
		{ "id": "c-18", "instrumentId": "inst-hihat", "startTime": 16, "duration": 1 },
		{ "id": "c-19", "instrumentId": "inst-toc", "startTime": 16, "duration": 1 },
		{ "id": "c-20", "instrumentId": "inst-clac", "startTime": 17, "duration": 1 },
		{ "id": "c-21", "instrumentId": "inst-hihat", "startTime": 17, "duration": 1 },
		{ "id": "c-22", "instrumentId": "inst-snare", "startTime": 18, "duration": 1 },
		{ "id": "c-23", "instrumentId": "inst-hihat", "startTime": 18, "duration": 1 },
		{ "id": "c-24", "instrumentId": "inst-toc", "startTime": 18, "duration": 1 },
		{ "id": "c-25", "instrumentId": "inst-click", "startTime": 19, "duration": 1 },
		{ "id": "c-26", "instrumentId": "inst-hihat", "startTime": 19, "duration": 1 },
		{ "id": "c-27", "instrumentId": "inst-kick", "startTime": 20, "duration": 1 },
		{ "id": "c-28", "instrumentId": "inst-pop", "startTime": 20, "duration": 1 },
		{ "id": "c-29", "instrumentId": "inst-hihat", "startTime": 20, "duration": 1 },
		{ "id": "c-30", "instrumentId": "inst-toc", "startTime": 20, "duration": 1 },
		{ "id": "c-31", "instrumentId": "inst-clac", "startTime": 21, "duration": 1 },
		{ "id": "c-32", "instrumentId": "inst-hihat", "startTime": 21, "duration": 1 },
		{ "id": "c-33", "instrumentId": "inst-snare", "startTime": 22, "duration": 1 },
		{ "id": "c-34", "instrumentId": "inst-hihat", "startTime": 22, "duration": 1 },
		{ "id": "c-35", "instrumentId": "inst-toc", "startTime": 22, "duration": 1 },
		{ "id": "c-36", "instrumentId": "inst-click", "startTime": 23, "duration": 1 },
		{ "id": "c-37", "instrumentId": "inst-hihat", "startTime": 23, "duration": 1 },
		{ "id": "c-38", "instrumentId": "inst-kick", "startTime": 24, "duration": 1 },
		{ "id": "c-39", "instrumentId": "inst-hihat", "startTime": 24, "duration": 1 },
		{ "id": "c-40", "instrumentId": "inst-toc", "startTime": 24, "duration": 1 },
		{ "id": "c-41", "instrumentId": "inst-clac", "startTime": 25, "duration": 1 },
		{ "id": "c-42", "instrumentId": "inst-hihat", "startTime": 25, "duration": 1 },
		{ "id": "c-43", "instrumentId": "inst-snare", "startTime": 26, "duration": 1 },
		{ "id": "c-44", "instrumentId": "inst-hihat", "startTime": 26, "duration": 1 },
		{ "id": "c-45", "instrumentId": "inst-toc", "startTime": 26, "duration": 1 },
		{ "id": "c-46", "instrumentId": "inst-click", "startTime": 27, "duration": 1 },
		{ "id": "c-47", "instrumentId": "inst-hihat", "startTime": 27, "duration": 1 },
		{ "id": "c-48", "instrumentId": "inst-kick", "startTime": 28, "duration": 1 },
		{ "id": "c-49", "instrumentId": "inst-pop", "startTime": 28, "duration": 1 },
		{ "id": "c-50", "instrumentId": "inst-hihat", "startTime": 28, "duration": 1 },
		{ "id": "c-51", "instrumentId": "inst-toc", "startTime": 28, "duration": 1 },
		{ "id": "c-52", "instrumentId": "inst-clac", "startTime": 29, "duration": 1 },
		{ "id": "c-53", "instrumentId": "inst-hihat", "startTime": 29, "duration": 1 },
		{ "id": "c-54", "instrumentId": "inst-snare", "startTime": 30, "duration": 1 },
		{ "id": "c-55", "instrumentId": "inst-hihat", "startTime": 30, "duration": 1 },
		{ "id": "c-56", "instrumentId": "inst-toc", "startTime": 30, "duration": 1 },
		{ "id": "c-57", "instrumentId": "inst-click", "startTime": 31, "duration": 1 },
		{ "id": "c-58", "instrumentId": "inst-hihat", "startTime": 31, "duration": 1 },

		{ "id": "c-59", "instrumentId": "inst-kick", "startTime": 32, "duration": 1 },
		{ "id": "c-60", "instrumentId": "inst-hihat", "startTime": 32, "duration": 1 },
		{ "id": "c-61", "instrumentId": "inst-toc", "startTime": 32, "duration": 1 },
		{ "id": "c-62", "instrumentId": "inst-clac", "startTime": 33, "duration": 1 },
		{ "id": "c-63", "instrumentId": "inst-hihat", "startTime": 33, "duration": 1 },
		{ "id": "c-64", "instrumentId": "inst-snare", "startTime": 34, "duration": 1 },
		{ "id": "c-65", "instrumentId": "inst-hihat", "startTime": 34, "duration": 1 },
		{ "id": "c-66", "instrumentId": "inst-toc", "startTime": 34, "duration": 1 },
		{ "id": "c-67", "instrumentId": "inst-click", "startTime": 35, "duration": 1 },
		{ "id": "c-68", "instrumentId": "inst-hihat", "startTime": 35, "duration": 1 },
		{ "id": "c-69", "instrumentId": "inst-kick", "startTime": 36, "duration": 1 },
		{ "id": "c-70", "instrumentId": "inst-pop", "startTime": 36, "duration": 1 },
		{ "id": "c-71", "instrumentId": "inst-hihat", "startTime": 36, "duration": 1 },
		{ "id": "c-72", "instrumentId": "inst-toc", "startTime": 36, "duration": 1 },
		{ "id": "c-73", "instrumentId": "inst-clac", "startTime": 37, "duration": 1 },
		{ "id": "c-74", "instrumentId": "inst-hihat", "startTime": 37, "duration": 1 },
		{ "id": "c-75", "instrumentId": "inst-snare", "startTime": 38, "duration": 1 },
		{ "id": "c-76", "instrumentId": "inst-hihat", "startTime": 38, "duration": 1 },
		{ "id": "c-77", "instrumentId": "inst-toc", "startTime": 38, "duration": 1 },
		{ "id": "c-78", "instrumentId": "inst-click", "startTime": 39, "duration": 1 },
		{ "id": "c-79", "instrumentId": "inst-hihat", "startTime": 39, "duration": 1 },
		{ "id": "c-80", "instrumentId": "inst-hihat-open", "startTime": 39, "duration": 1 },
		{ "id": "c-81", "instrumentId": "inst-kick", "startTime": 40, "duration": 1 },
		{ "id": "c-82", "instrumentId": "inst-hihat", "startTime": 40, "duration": 1 },
		{ "id": "c-83", "instrumentId": "inst-toc", "startTime": 40, "duration": 1 },
		{ "id": "c-84", "instrumentId": "inst-clac", "startTime": 41, "duration": 1 },
		{ "id": "c-85", "instrumentId": "inst-hihat", "startTime": 41, "duration": 1 },
		{ "id": "c-86", "instrumentId": "inst-snare", "startTime": 42, "duration": 1 },
		{ "id": "c-87", "instrumentId": "inst-hihat", "startTime": 42, "duration": 1 },
		{ "id": "c-88", "instrumentId": "inst-toc", "startTime": 42, "duration": 1 },
		{ "id": "c-89", "instrumentId": "inst-click", "startTime": 43, "duration": 1 },
		{ "id": "c-90", "instrumentId": "inst-hihat", "startTime": 43, "duration": 1 },
		{ "id": "c-91", "instrumentId": "inst-kick", "startTime": 44, "duration": 1 },
		{ "id": "c-92", "instrumentId": "inst-pop", "startTime": 44, "duration": 1 },
		{ "id": "c-93", "instrumentId": "inst-hihat", "startTime": 44, "duration": 1 },
		{ "id": "c-94", "instrumentId": "inst-toc", "startTime": 44, "duration": 1 },